{
  "schema_version": 1,
  "families": [
    "api",
    "bridge",
    "config",
    "election",
    "external",
    "metering",
    "metrics_log",
    "routing",
    "runtime",
    "topology"
  ],
  "contracts": [
    {
      "id": "CP-API-001",
      "family": "api",
      "summary": "Admin config, status, drain, close, health, and diagnostic responses retain Go status codes, bounded errors, and idempotency.",
      "go_owner": "pkg/server/api",
      "rust_target": "#150",
      "go_baseline": "anchored",
      "rust_status": "pending",
      "anchors": [
        {"path": "pkg/server/api/config_test.go", "contains": "func TestConfig"},
        {"path": "pkg/server/api/dataplane_test.go", "contains": "func TestDataplaneStatusAPI"},
        {"path": "pkg/controlbridge/route_owner_handler_test.go", "contains": "func TestRouteOwnerRejectsRetiredDrainBodiesWithoutState"}
      ],
      "observed_fields": ["http_status", "response_code", "drain_id", "command_sequence", "applied_generation"],
      "fault_scenarios": ["CP-FAULT-ADMIN-DRAIN-REPLAY", "CP-FAULT-CONTROL-UNAVAILABLE"],
      "bridge_messages": ["drain_command", "drain_result", "close_command", "close_result"],
      "handoff": "Implement CP-ADMIN against these responses before retiring the Go API and operator bridge."
    },
    {
      "id": "CP-BRIDGE-001",
      "family": "bridge",
      "summary": "The residual Go/Rust migration adapter preserves version negotiation, capabilities, epoch and generation lineage, request correlation, bounded queues, and fail-closed reconnect behavior until final cutover.",
      "go_owner": "pkg/controlbridge and pkg/controlbridge/transport",
      "rust_target": "#153",
      "go_baseline": "anchored",
      "rust_status": "pending",
      "anchors": [
        {"path": "pkg/controlbridge/transport/server_test.go", "contains": "func TestServerHandshakeLifecycleAndReconnect"},
        {"path": "pkg/controlbridge/bridge_test.go", "contains": "func TestBridgeOwnsListenerAndCadenceLifecycle"},
        {"path": "pkg/controlbridge/pb/codec_test.go", "contains": "func TestFrameBoundsAndPartialIO"}
      ],
      "observed_fields": ["protocol_version", "capabilities", "control_epoch", "generation", "request_id", "process_id"],
      "fault_scenarios": ["CP-FAULT-BRIDGE-RECONNECT", "CP-FAULT-PROCESS-DEATH"],
      "bridge_messages": ["hello", "hello_ack", "heartbeat", "error", "reconcile_request", "reconcile_snapshot"],
      "handoff": "Keep this legacy adapter shrink-only while responsibilities remain in Go; delete its final transport lifecycle at CP-CUTOVER."
    },
    {
      "id": "CP-RUNTIME-001",
      "family": "runtime",
      "summary": "One Rust process owns the in-process control runtime, domain module seam, lifecycle, ordered shutdown, atomic last-good config/TLS views, and bounded logs and metrics.",
      "go_owner": "pkg/server plus pkg/manager/config, pkg/manager/cert, pkg/manager/logger, and pkg/metrics",
      "rust_target": "#142",
      "go_baseline": "anchored",
      "rust_status": "owned",
      "anchors": [
        {"path": "pkg/server/server.go", "contains": "func NewServer"},
        {"path": "pkg/server/server.go", "contains": "func (s *Server) Close"},
        {"path": "rust/crates/control-plane/src/runtime.rs", "contains": "pub struct ControlRuntime"},
        {"path": "tests/controlplane/cp001/go-observer/main.go", "contains": "func run"}
      ],
      "observed_fields": ["process_id", "owner_generation", "config_generation", "lifecycle_phase", "shutdown_reason", "tls_generation", "log_level", "metrics_namespace"],
      "fault_scenarios": ["CP-FAULT-RUNTIME-CONFIG-RELOAD", "CP-FAULT-RUNTIME-MODULE-FAILURE", "CP-FAULT-PROCESS-DEATH"],
      "bridge_messages": [],
      "handoff": "All later Rust control modules compose through this process-local domain/runtime; no module may introduce a second process, transport, or protobuf domain model."
    },
    {
      "id": "CP-CONFIG-001",
      "family": "config",
      "summary": "Config parsing, defaults, validation, cloning, reload, removal, and checksums remain atomic and deterministic.",
      "go_owner": "lib/config and pkg/manager/config",
      "rust_target": "#146",
      "go_baseline": "anchored",
      "rust_status": "owned",
      "anchors": [
        {"path": "lib/config/proxy_test.go", "contains": "func TestProxyConfig"},
        {"path": "pkg/manager/config/config_test.go", "contains": "func TestConfigReload"},
        {"path": "pkg/manager/config/config_test.go", "contains": "func TestChecksum"},
        {"path": "rust/crates/control-config/src/model.rs", "contains": "pub struct EffectiveConfig"},
        {"path": "rust/crates/control-config/src/source.rs", "contains": "pub struct ConfigNamespaceStore"},
        {"path": "tests/controlplane/cp004/run.sh", "contains": "CP-CFG/NS differential and real-etcd evidence passed"}
      ],
      "observed_fields": ["checksum", "reload_result", "validation_class", "effective_defaults", "restart_required"],
      "fault_scenarios": ["CP-FAULT-CONFIG-INVALID-RELOAD"],
      "bridge_messages": ["state_snapshot", "snapshot_result"],
      "handoff": "Rust now owns the full canonical model, contiguous accepted generations, atomic last-good file/etcd overlays, and checksums. The bridge message pair remains only for residual protocol/static and backend fields."
    },
    {
      "id": "CP-CONFIG-002",
      "family": "config",
      "summary": "Every dynamic control value is projected in stable order while unsupported or restart-required changes fail closed.",
      "go_owner": "pkg/controlbridge/snapshot.go",
      "rust_target": "#146",
      "go_baseline": "anchored",
      "rust_status": "owned",
      "anchors": [
        {"path": "pkg/controlbridge/snapshot_test.go", "contains": "func TestSnapshotBuilderBuildsCompleteDeterministicSnapshot"},
        {"path": "pkg/controlbridge/snapshot_test.go", "contains": "func TestSnapshotBuilderRejectsUnsafeOrRestartRequiredValues"},
        {"path": "pkg/controlbridge/snapshot_publisher_test.go", "contains": "func TestSnapshotPublisherApplyRejectReconnectAndCoalesce"},
        {"path": "rust/crates/control-config/src/module.rs", "contains": "pub struct ConfigModule"},
        {"path": "rust/crates/tiproxy-rs/src/config_composition.rs", "contains": "pub struct ConfigServingAdapter"},
        {"path": "pkg/controlbridge/snapshot_publisher.go", "contains": "func shrinkRustOwnedSnapshot"}
      ],
      "observed_fields": ["generation", "source_revision", "config_checksum", "namespace_checksum", "effective_config", "ordered_namespaces", "apply_result"],
      "fault_scenarios": ["CP-FAULT-CONFIG-SNAPSHOT-REJECT"],
      "bridge_messages": ["state_snapshot", "snapshot_result"],
      "handoff": "Rust owns all config and namespace projection fields. With capability 5, Go sends only advertised_capability, server_version, and backends; state_snapshot/snapshot_result remain until CP-TOPO/CP-ROUTE retire that residual surface."
    },
    {
      "id": "CP-CONFIG-003",
      "family": "config",
      "summary": "Certificate and TLS policy changes rotate safely for new connections without corrupting established sessions or accepting partial material.",
      "go_owner": "pkg/manager/cert",
      "rust_target": "#146",
      "go_baseline": "anchored",
      "rust_status": "owned",
      "anchors": [
        {"path": "pkg/manager/cert/manager_test.go", "contains": "func TestRotate"},
        {"path": "pkg/manager/cert/manager_test.go", "contains": "func TestWatchConfig"},
        {"path": "pkg/controlbridge/snapshot.go", "contains": "minimum TLS version must be 1.2 or 1.3"},
        {"path": "rust/crates/control-config/src/source.rs", "contains": "pub fn refresh_external_material"},
        {"path": "rust/crates/tiproxy-rs/src/config_composition.rs", "contains": "pub struct ServingCandidateValidator"},
        {"path": "rust/crates/control-config/tests/source.rs", "contains": "fn external_material_refresh_advances_generation_and_retains_last_good_on_rejection"}
      ],
      "observed_fields": ["certificate_generation", "minimum_tls_version", "allowed_common_names", "existing_session_state", "new_connection_result"],
      "fault_scenarios": ["CP-FAULT-TLS-ROTATION"],
      "bridge_messages": ["state_snapshot", "snapshot_result"],
      "handoff": "Rust validates and content-watches every global and namespace TLS material path, advances an atomic immutable generation for accepted rotations, and retains last-good on partial/invalid material. CP-ADMIN/CP-TOPO/CP-ROUTE consume their non-SQL projections later."
    },
    {
      "id": "CP-ELECT-001",
      "family": "election",
      "summary": "Etcd lease election preserves single ownership, explicit owner identity, session loss, transient failure, and retirement semantics.",
      "go_owner": "pkg/manager/elect",
      "rust_target": "#144",
      "go_baseline": "anchored",
      "rust_status": "owned",
      "anchors": [
        {"path": "pkg/manager/elect/election_test.go", "contains": "func TestElectOwner"},
        {"path": "pkg/manager/elect/election_test.go", "contains": "func TestEtcdServerDown"},
        {"path": "pkg/manager/elect/election_test.go", "contains": "func TestOwnerHang"},
        {"path": "rust/crates/control-etcd/src/session.rs", "contains": "pub struct ElectionSession"},
        {"path": "tests/controlplane/cp003/go-observer/main.go", "contains": "func run"}
      ],
      "observed_fields": ["owner_id", "lease_id", "owner_state", "session_revision", "retirement_reason"],
      "fault_scenarios": ["CP-FAULT-ELECTION-WATCH-COMPACTION", "CP-FAULT-ETCD-PROCESS-DEATH", "CP-FAULT-ETCD-TRANSIENT", "CP-FAULT-LEASE-LOSS"],
      "bridge_messages": [],
      "handoff": "The Rust election/session object must prove one active owner and the same retirement boundary before owner-only jobs move."
    },
    {
      "id": "CP-EXT-001",
      "family": "external",